{
  "vertical": "todo",
  "displayName": "Todo app",
  "summary": "A minimal todo list app used to demonstrate the SaaS Factory workflow end-to-end.",
  "positioning": "Tiny vertical for learning: spec → tasks → dev → quality gates → ship.",
  "primaryUser": "Individual user",
  "secondaryUsers": [],
  "regions": ["US"],
  "compliance": ["none (demo app)"],
  "billingModel": "n/a",
  "integrationsWishlist": [],
  "mvpScopeHint": "MVP: add/list/complete/delete todos. Persistence: local-only at first; optional API later."
}

