{
  "vertical": "plumber",
  "displayName": "Plumbing trade",
  "summary": "Job dispatch, estimates, and field workflows for small plumbing businesses.",
  "positioning": "Mobile-first job board + customer comms on shared core-saas; lighter compliance than healthcare.",
  "primaryUser": "Owner / dispatcher",
  "secondaryUsers": ["Field technician", "Office admin"],
  "regions": ["US", "CA"],
  "compliance": ["PII for customers; card data via Stripe only"],
  "billingModel": "Subscription by active technicians; optional usage-based SMS.",
  "integrationsWishlist": ["Stripe", "Maps routing", "Twilio SMS", "QuickBooks export (Phase 2)"],
  "mvpScopeHint": "MVP: org + roles, customers, jobs (status pipeline), assignments, photo attachments, estimates + Stripe payment link, SMS stub or Twilio."
}
